{
  "project": "ChromeWheelRouter",
  "current_decision": "做",
  "scope": {
    "in_scope": [
      "Chrome only",
      "Option-only + horizontal scroll => Chrome page zoom",
      "bare horizontal scroll pass-through so Logi Options+ can keep handling it",
      "safe macOS menu bar app",
      "automatic install package and user documentation as final deliverables"
    ],
    "out_of_scope": [
      "Wuying / remote desktop support",
      "BetterTouchTool clone",
      "global mouse automation",
      "keyboard event recorder",
      "telemetry or network sync",
      "modifying Logi Options+ configuration"
    ]
  },
  "open_questions": [
    "How should the final app expose start-at-login?",
    "Should first public deliverable be DMG only or DMG plus PKG?",
    "Will signing/notarization credentials be available?"
  ],
  "next_action": "工程化方案：use Codex Cloud to implement the repo incrementally from pure core to macOS app to packaging",
  "definition_of_done": [
    "ChromeWheelRouter.app built successfully",
    "DMG installer produced",
    "usage documentation included",
    "uninstall documentation included",
    "security documentation included",
    "Chrome + Option + horizontal scroll zooms page on a real Mac",
    "Chrome + bare horizontal scroll remains handled by Logi Options+ on a real Mac",
    "Disable and Quit restore baseline behavior",
    "uninstall removes app/config/logs and documents manual permission revocation"
  ],
  "safety_invariants": [
    "event tap listens only to scrollWheel",
    "no keyDown/keyUp event taps",
    "no telemetry",
    "no network APIs",
    "no root install",
    "no LaunchDaemon",
    "no driver or kernel/system extension",
    "unmatched events must return the original event",
    "only Chrome + Option-only + horizontal scroll may be swallowed"
  ],
  "backlog": [
    {
      "id": "CWR-001",
      "title": "Scaffold pure routing core and tests",
      "status": "done",
      "notes": "Initial scaffold includes core model and tests."
    },
    {
      "id": "CWR-002",
      "title": "Add macOS CGEventTap adapter",
      "status": "todo",
      "notes": "Must listen only to scrollWheel."
    },
    {
      "id": "CWR-003",
      "title": "Add menu bar app shell",
      "status": "todo",
      "notes": "Enable, disable, dry run, permission status, logs, quit."
    },
    {
      "id": "CWR-004",
      "title": "Add permission guidance",
      "status": "todo",
      "notes": "Accessibility and Input Monitoring only."
    },
    {
      "id": "CWR-005",
      "title": "Add packaging scripts",
      "status": "todo",
      "notes": "DMG first; PKG optional."
    },
    {
      "id": "CWR-006",
      "title": "Add user/security/troubleshooting docs",
      "status": "todo",
      "notes": "Must include manual QA and uninstall instructions."
    }
  ],
  "manual_validation_required": [
    "MX Master horizontal wheel on real Mac",
    "Logi Options+ coexistence with bare horizontal scroll",
    "Chrome zoom behavior",
    "macOS Accessibility permission prompt",
    "macOS Input Monitoring permission prompt",
    "disable/quit/uninstall behavior"
  ],
  "last_updated_by": "initial scaffold",
  "last_updated_note": "Built project kickoff state based on user requirements."
}
